{
  "version": "0",
  "id": "f71bbbbb-5b36-40c2-f7dc-804ca6270cd6",
  "detail-type": "AnalysisRunStateChange",
  "source": "orcabus.workflowmanager",
  "account": "123456789012",
  "time": "2024-05-01T09:25:44Z",
  "region": "ap-southeast-2",
  "resources": [],
  "detail": {
    "id": "hash(values) e.g. 97534601940f17ebcfee02e9df998244",
    "version": "<semver> e.g. 1.0.0",
    "timestamp": "2025-05-01T09:25:44Z",
    "orcabusId": "anr.76J5N2J83RED7387G9374NGDBB",
    "analysisRunName": "<unique analysis name>",
    "status": "DRAFT",
    "analysis": {
      "orcabusId": "ana.76J5N2J83RED7387G9374NGDBA",
      "name": "<analysis name>, e.g. oncoanalyser-dna",
      "version": "<analysis version>, e.g. 1.0.4"
    }
  }
}
